{
  "$schema": "./offline-toolkit-manifest-v1.schema.json",
  "schema_version": "offline-toolkit-manifest-v1",
  "manifest_id": "job-skill-shelver-offline-toolkit-v2.2",
  "toolkit_version": "2.2",
  "status": "LOCKED_FOR_PRODUCTION",
  "generated_at": "2026-07-22T14:50:00+08:00",
  "source_files": [
    {
      "path": "doc/reference/offline-toolkit-procurement-spec.md",
      "sha256": "sha256:48b46e2899f2792b084221cbc70fad479a82815004d17a82aef6344b28e04f0a"
    },
    {
      "path": "doc/features/job-skill-shelver-298-disposition-authority-v1.json",
      "sha256": "sha256:dcb41700a19a1a9de6345b52f902519843fd1ee00976d10ed2fba985db4fa7e8"
    },
    {
      "path": "doc/features/job-skill-shelver-298-question-revision-candidates-v1.json",
      "sha256": "sha256:070d0f18a3e2d7ad7446626a7c5d4cd8019f6013842f32b28b920387a2f6a588"
    },
    {
      "path": "doc/features/job-skill-shelver-298-question-revision-candidates-v3.json",
      "sha256": "sha256:3facf23ba4502ab23a00c20c6dab281ac56d3dcd447599f5524d22a9a2d62064"
    },
    {
      "path": "doc/features/job-skill-shelver-298-question-revision-candidates-v4.json",
      "sha256": "sha256:cc717f9d7f062929f83244d1fa676c4d761a9d3dc1851a0a161261033c464f2d"
    },
    {
      "path": "doc/features/job-skill-shelver-298-question-revision-candidates-v5.json",
      "sha256": "sha256:b652cb833a00f351f30825865ebb1df5b8142b6e37c7a0466d45d59a9301cf93"
    },
    {
      "path": "doc/features/job-skill-shelver-298-question-revision-candidates-v6.json",
      "sha256": "sha256:35b138d3dc291de3518f42ddbc287587813ad5f09e30fb795abf73ad5dbb26d9"
    },
    {
      "path": "doc/features/job-skill-shelver-298-targeted-v6-rereview-merged-gate-v1.json",
      "sha256": "sha256:22c365073051606d6be82ea261c072c5d5762f59a24145f602d554d52a207319"
    },
    {
      "path": "doc/features/job-skill-shelver-298-rejected-replacement-candidates-v2.json",
      "sha256": "sha256:36a7c8fd3f48799c66804586e30fbc849cd62f9dba7090a355a7b6c156008f97"
    },
    {
      "path": "doc/features/job-skill-shelver-298-rejected-replacement-targeted-candidates-v3.json",
      "sha256": "sha256:25bbed1f1f3eca7a24f797afd70727077f8f5581812c2003dfe12d5590d1a257"
    },
    {
      "path": "doc/features/job-skill-shelver-298-rejected-replacement-targeted-candidates-v4.json",
      "sha256": "sha256:826c0e0f28a4f22a26fab5c2334ad04c8f05b9c086626d3991f531c26f40156c"
    },
    {
      "path": "doc/features/job-skill-shelver-298-rejected-replacement-targeted-v4-rereview-merged-gate-v1.json",
      "sha256": "sha256:6b3fa4573ba9ed149ebbfbbe83692a1f2ffe52298e7de472648c86ddf41b0a87"
    },
    {
      "path": "doc/features/job-skill-shelver-pilot-revision-candidates-v3.json",
      "sha256": "sha256:9d4eec169ed601cc25af0b00741f09415c808f5fbb150c8ac867031be697219f"
    },
    {
      "path": "doc/assets/asset-manifest.json",
      "sha256": "sha256:cf2ff17fb4899073c0cd9369ee926737ac6fe578f7f4d9c0a96b4cfa669a2628"
    }
  ],
  "summary": {
    "offline_question_total": 100,
    "inventory_item_total": 22,
    "by_module": {
      "M1": 16,
      "M2": 15,
      "M3": 16,
      "M4": 21,
      "M5": 17,
      "M6": 15
    },
    "date_question_total": 20,
    "script_question_total": 13,
    "example_image_total": 4
  },
  "inventory": [
    {
      "item_id": "station_stable_work_surface",
      "kind": "PHYSICAL",
      "description": "稳定工作台面和评测站位",
      "quantity_contract": "每站位 1 套",
      "safety_contract": "无松动、无锐边、通道无遮挡"
    },
    {
      "item_id": "kit_reset_checklist",
      "kind": "DOCUMENT",
      "description": "工具包 v2.2 逐题复位清单",
      "quantity_contract": "每站位 1 份覆膜件",
      "safety_contract": "只展示材料复位，不展示密封答案"
    },
    {
      "item_id": "shelf_three_tier",
      "kind": "PHYSICAL",
      "description": "三层可调迷你陈列货架",
      "quantity_contract": "每站位 1 组",
      "safety_contract": "固定防倾倒，操作高度不得要求攀爬"
    },
    {
      "item_id": "products_general_set",
      "kind": "PHYSICAL",
      "description": "G01-G20 通用商品及近邻/规格副本",
      "quantity_contract": "按 v2.2 固定编号和数量",
      "safety_contract": "全部标注教学评测专用，禁止食用或使用"
    },
    {
      "item_id": "products_fixed_date_set_g01_g12_g15_g16",
      "kind": "PHYSICAL",
      "description": "G01-G12、G15-G16 共 14 件固定模拟日期商品",
      "quantity_contract": "每站位 14 件",
      "safety_contract": "标签模糊或脱落时停止评分并更换"
    },
    {
      "item_id": "simulated_work_date_sign",
      "kind": "DOCUMENT",
      "description": "固定模拟工作日 2026-09-10 日期牌",
      "quantity_contract": "每站位 1 张",
      "safety_contract": "不得替换为现实日期"
    },
    {
      "item_id": "zone_expiry_handling",
      "kind": "PHYSICAL",
      "description": "临期待处理区和报损隔离区标识",
      "quantity_contract": "各 1 个",
      "safety_contract": "区域边界清晰且不阻挡通道"
    },
    {
      "item_id": "boundary_samples_d01_d05",
      "kind": "PHYSICAL",
      "description": "D01-D05 无伤害边界样品",
      "quantity_contract": "每站位 5 件",
      "safety_contract": "无腐败物、无液体、无锐边和真实压力"
    },
    {
      "item_id": "zone_problem_goods",
      "kind": "PHYSICAL",
      "description": "问题商品区及周转箱",
      "quantity_contract": "每站位 1 套",
      "safety_contract": "与正常商品区物理分离"
    },
    {
      "item_id": "ppe_cut_resistant_gloves",
      "kind": "PHYSICAL",
      "description": "防割手套",
      "quantity_contract": "每站位 1 双，按尺码备选",
      "safety_contract": "破损或不合手时不得使用"
    },
    {
      "item_id": "safe_box_cutter",
      "kind": "PHYSICAL",
      "description": "自动回弹安全开箱刀",
      "quantity_contract": "每站位 1 把",
      "safety_contract": "仅用于明确允许刀具的场景；徒手拆箱题不得提供"
    },
    {
      "item_id": "cartons_b01_b03",
      "kind": "PHYSICAL",
      "description": "B01-B03 标准训练纸箱",
      "quantity_contract": "每站位 3 个",
      "safety_contract": "重量和封装方式按逐题清单复位"
    },
    {
      "item_id": "delivery_document_set",
      "kind": "DOCUMENT",
      "description": "送货单、库存表、差异版文件及答案封套",
      "quantity_contract": "每站位 1 套",
      "safety_contract": "学员材料与密封答案分开存放"
    },
    {
      "item_id": "recording_stationery_set",
      "kind": "PHYSICAL",
      "description": "记录表、记录本、笔和计算器",
      "quantity_contract": "每站位 1 套",
      "safety_contract": "书写工具无尖锐破损"
    },
    {
      "item_id": "offline_scanner_with_sku_json",
      "kind": "PHYSICAL",
      "description": "离线扫码设备、本地 SKU JSON 与纸面编号回退表",
      "quantity_contract": "每站位 1 套",
      "safety_contract": "不得联网；技术故障不按答错处理"
    },
    {
      "item_id": "cold_chain_samples_and_zone_labels",
      "kind": "PHYSICAL",
      "description": "3 件唯一可判断冷链样品及冷藏/冷冻标签",
      "quantity_contract": "每站位 1 套",
      "safety_contract": "使用安全空包装，不使用需真实冷藏的食品"
    },
    {
      "item_id": "role_play_badges",
      "kind": "PHYSICAL",
      "description": "负责人、顾客和同事角色胸牌",
      "quantity_contract": "每站位 1 套",
      "safety_contract": "评估员按锁定脚本表演，不即兴改变评分条件"
    },
    {
      "item_id": "safe_cleanup_set",
      "kind": "CONSUMABLE",
      "description": "警示牌、钝边碎片、吸水垫和清洁工具",
      "quantity_contract": "每站位 1 套",
      "safety_contract": "不得使用真实玻璃、刺激性液体或锐器"
    },
    {
      "item_id": "recall_marker_set",
      "kind": "DOCUMENT",
      "description": "3 件召回标记、召回通知和密封答案键",
      "quantity_contract": "每站位 1 套",
      "safety_contract": "召回标识仅用于教具，避免与真实商品混用"
    },
    {
      "item_id": "software_visible_timer",
      "kind": "SOFTWARE",
      "description": "软件可视计时器",
      "quantity_contract": "每评测终端 1 个",
      "safety_contract": "正确率和安全优先于速度；技术中断暂停计时"
    },
    {
      "item_id": "powered_off_equipment_prop",
      "kind": "PHYSICAL",
      "description": "断电设备外壳或设备图片卡",
      "quantity_contract": "每站位 1 件",
      "safety_contract": "不得接电、不得制造真实机械风险"
    },
    {
      "item_id": "folding_step_stool",
      "kind": "PHYSICAL",
      "description": "折叠两步踏脚凳",
      "quantity_contract": "每站位 1 个",
      "safety_contract": "仅作场景道具；需要攀爬时由评估员接管"
    }
  ],
  "setups": [
    {
      "setup_id": "setup_m1_ob_048_v3",
      "source_question_id": "M1_OB_048",
      "current_question_id": "M1_OB_048_V3",
      "module": "M1",
      "status": "LOCKED_FOR_PRODUCTION",
      "item_ids": [
        "kit_reset_checklist",
        "role_play_badges",
        "safe_cleanup_set",
        "station_stable_work_surface"
      ],
      "asset_ids": [
        "asset_offline_tool_09"
      ],
      "public_instruction": "按清单布置“补货时发现通道中央有一处不明液体（使用蓝色防滑仿真水渍标识片模拟）。请按门店流程处置。”所需材料；开始前确认数量、位置和安全状态。",
      "reset_instruction": "按 item_ids 逐项复位并核对数量；一次性耗材按 v2.2 补充规则更换。",
      "answer_contract_hash": "sha256:69446237a9205182a4fb54d8e922ab4b9a5f83080441de8199abead5dcf5229f"
    },
    {
      "setup_id": "setup_m1_op_033_v2",
      "source_question_id": "M1_OP_033",
      "current_question_id": "M1_OP_033_V2",
      "module": "M1",
      "status": "LOCKED_FOR_PRODUCTION",
      "item_ids": [
        "kit_reset_checklist",
        "products_general_set",
        "shelf_three_tier",
        "station_stable_work_surface"
      ],
      "asset_ids": [],
      "public_instruction": "按清单布置“将5件轻型训练商品摆到货架中层，做到正面朝外、竖直稳定并使同排前沿基本对齐。”所需材料；开始前确认数量、位置和安全状态。",
      "reset_instruction": "按 item_ids 逐项复位并核对数量；一次性耗材按 v2.2 补充规则更换。",
      "answer_contract_hash": "sha256:b7336382e133e22caa53d4d84662c740ee07e29642ef13970b75255ee299bb92"
    },
    {
      "setup_id": "setup_m1_op_034_v4",
      "source_question_id": "M1_OP_034",
      "current_question_id": "M1_OP_034_V4",
      "module": "M1",
      "status": "LOCKED_FOR_PRODUCTION",
      "item_ids": [
        "kit_reset_checklist",
        "products_general_set",
        "shelf_three_tier",
        "station_stable_work_surface"
      ],
      "asset_ids": [
        "asset_offline_tool_05"
      ],
      "public_instruction": "按清单布置“把5张价签放到对应商品的正下方”所需材料；开始前确认数量、位置和安全状态。",
      "reset_instruction": "按 item_ids 逐项复位并核对数量；一次性耗材按 v2.2 补充规则更换。",
      "answer_contract_hash": "sha256:ba2170a161318ab22e206e4c7df358ecd19b8fa87e869ab08d300a73607b2eb6"
    },
    {
      "setup_id": "setup_m1_op_035_v4",
      "source_question_id": "M1_OP_035",
      "current_question_id": "M1_OP_035_V4",
      "module": "M1",